{
  "schemaVersion": "1.0.0",
  "id": "ship-the-helm",
  "title": "Ship the Helm",
  "kind": "project-note",
  "project": "cerebralhelm",
  "sensitivity": "private",
  "cloudPolicy": "deny",
  "status": "active",
  "created": "2026-06-28T00:00:00.000Z",
  "updated": "2026-06-28T12:00:00.000Z",
  "reviewAfter": "2026-07-28T00:00:00.000Z"
}
